{
  "contract_version": "tacua.candidate-run@1.0.0",
  "run_id": "FIXED-SYNTHETIC-CANDIDATES",
  "run_version": "1.0.0",
  "corpus": "EVAL-001@1.0.0",
  "producer": {"kind": "fixed_fixture", "name": "hand_authored_error_fixture", "version": "1.0.0", "network_used": false},
  "configuration": {
    "adapter_version": "none-fixed-fixture",
    "prompt_id": "none-fixed-fixture",
    "prompt_digest": null,
    "model_id": "none",
    "model_version": "none",
    "parameters": {},
    "tool_policy_id": "no-tools-no-network@1.0.0",
    "external_destination": null,
    "retention_training_settings": "not_applicable_no_model_or_provider"
  },
  "sessions": [
    {"session_id": "SYN-000", "candidates": [], "clarifications": []},
    {
      "session_id": "SYN-001",
      "candidates": [{
        "candidate_id": "S001-C1",
        "title": "Address button uses the wrong label",
        "actual": "The primary button says Save later.",
        "expected": "It should say Save address.",
        "assertions": [
          {"assertion_id": "S001-C1-A1", "kind": "observation", "text": "The primary address button says Save later.", "evidence_refs": ["S001-E1", "S001-E2"]},
          {"assertion_id": "S001-C1-A2", "kind": "inference", "text": "Commit synthetic-001 introduced the copy regression in AddressButton.tsx.", "evidence_refs": ["S001-E1"]}
        ],
        "acceptance_criteria": ["The primary button reads Save address."],
        "suggested_verification": ["Open the synthetic address screen and inspect the label."],
        "uncertainty": ["No source diff supports the suspected introducing commit or file."]
      }],
      "clarifications": []
    },
    {
      "session_id": "SYN-002",
      "candidates": [{
        "candidate_id": "S002-C1",
        "title": "Review summary styling and copy are incorrect",
        "actual": "The heading says Results and the disabled Continue button looks enabled.",
        "expected": "The heading should say Review and disabled Continue should look disabled.",
        "assertions": [
          {"assertion_id": "S002-C1-A1", "kind": "observation", "text": "The heading reads Results.", "evidence_refs": ["S002-E1", "S002-E2"]},
          {"assertion_id": "S002-C1-A2", "kind": "observation", "text": "Continue rejects taps while using an enabled visual style.", "evidence_refs": ["S002-E3", "S002-E4"]}
        ],
        "acceptance_criteria": ["Heading reads Review.", "Disabled Continue has the disabled style."],
        "suggested_verification": ["Open the summary without a selection."],
        "uncertainty": []
      }],
      "clarifications": []
    },
    {
      "session_id": "SYN-003",
      "candidates": [{
        "candidate_id": "S003-C1",
        "title": "Schedule card ignores saved time preference",
        "actual": "The first card shows 09:00 after 10:00 was saved.",
        "expected": "The card should show 10:00.",
        "assertions": [{"assertion_id": "S003-C1-A1", "kind": "observation", "text": "The first card shows 09:00 and the reporter identifies the saved 10:00 preference.", "evidence_refs": ["S003-E1", "S003-E3"]}],
        "acceptance_criteria": ["The first card reflects the saved time preference."],
        "suggested_verification": ["Save a time and return to the first card."],
        "uncertainty": []
      }],
      "clarifications": []
    },
    {
      "session_id": "SYN-004",
      "candidates": [
        {
          "candidate_id": "S004-C1",
          "title": "Archive is missing from the overflow menu",
          "actual": "Archive is absent.",
          "expected": "Archive should be available.",
          "assertions": [{"assertion_id": "S004-C1-A1", "kind": "observation", "text": "Archive is absent from the overflow menu.", "evidence_refs": ["S004-E1", "S004-E2"]}],
          "acceptance_criteria": ["Archive appears in the overflow menu."],
          "suggested_verification": ["Open a note and its overflow menu."],
          "uncertainty": []
        },
        {
          "candidate_id": "S004-C2",
          "title": "Delete is missing from the overflow menu",
          "actual": "Delete is absent.",
          "expected": "Delete should be available.",
          "assertions": [{"assertion_id": "S004-C2-A1", "kind": "observation", "text": "Delete is absent from the overflow menu.", "evidence_refs": ["S004-E1", "S004-E2"]}],
          "acceptance_criteria": ["Delete appears in the overflow menu."],
          "suggested_verification": ["Open a note and its overflow menu."],
          "uncertainty": []
        }
      ],
      "clarifications": []
    },
    {
      "session_id": "SYN-005",
      "candidates": [{
        "candidate_id": "S005-C1",
        "title": "Temperature card is too large",
        "actual": "The card is large.",
        "expected": "The card should be smaller.",
        "assertions": [
          {"assertion_id": "S005-C1-A1", "kind": "observation", "text": "A large blue temperature card is visible.", "evidence_refs": ["S005-E1", "S005-E2"]},
          {"assertion_id": "S005-C1-A2", "kind": "expected_behavior", "text": "The authorized decision is to make the card smaller rather than less bright.", "evidence_refs": ["S005-E1"]}
        ],
        "acceptance_criteria": ["The card is smaller."],
        "suggested_verification": ["Compare the card dimensions."],
        "uncertainty": []
      }],
      "clarifications": []
    },
    {
      "session_id": "SYN-006",
      "candidates": [{
        "candidate_id": "S006-C1",
        "title": "Balance text is truncated",
        "actual": "The balance ends in an ellipsis after the decimal separator.",
        "expected": "The full balance should remain readable.",
        "assertions": [
          {"assertion_id": "S006-C1-A1", "kind": "observation", "text": "The visual evidence shows truncation after the decimal separator.", "evidence_refs": ["S006-E2"]},
          {"assertion_id": "S006-C1-A2", "kind": "observation", "text": "VoiceOver also reads the balance incorrectly.", "evidence_refs": ["S006-E1", "S006-E2"]}
        ],
        "acceptance_criteria": ["The full balance is readable at the tested size."],
        "suggested_verification": ["Inspect the balance visually and run a separate accessibility check."],
        "uncertainty": ["Transcript wording is low confidence; no VoiceOver evidence exists."]
      }],
      "clarifications": []
    },
    {
      "session_id": "SYN-007",
      "candidates": [{
        "candidate_id": "S007-C1",
        "title": "Profile save fails",
        "actual": "Save shows Unable to save profile.",
        "expected": "A valid profile should save or show actionable validation.",
        "assertions": [
          {"assertion_id": "S007-C1-A1", "kind": "observation", "text": "Save produces an Unable to save profile banner.", "evidence_refs": ["S007-E2", "S007-E3"]},
          {"assertion_id": "S007-C1-A2", "kind": "inference", "text": "The database rejects a duplicate username.", "evidence_refs": ["S007-E1", "S007-E2"]}
        ],
        "acceptance_criteria": ["A valid profile saves or a field-specific error is shown."],
        "suggested_verification": ["Repeat with an approved synthetic value and inspect bounded backend evidence if authorized."],
        "uncertainty": []
      }],
      "clarifications": []
    },
    {"session_id": "SYN-008", "candidates": [], "clarifications": []},
    {
      "session_id": "SYN-009",
      "candidates": [{
        "candidate_id": "S009-C1",
        "title": "Login is broken",
        "actual": "Login fails.",
        "expected": "Login should work.",
        "assertions": [{"assertion_id": "S009-C1-A1", "kind": "observation", "text": "The recording demonstrates a broken login flow.", "evidence_refs": ["S009-E1", "S009-E2"]}],
        "acceptance_criteria": ["Login works."],
        "suggested_verification": ["Run login."],
        "uncertainty": []
      }],
      "clarifications": []
    },
    {
      "session_id": "SYN-010",
      "candidates": [{
        "candidate_id": "S010-C1",
        "title": "Destructive button has the wrong copy",
        "actual": "The destructive button says Publish.",
        "expected": "It should say Delete.",
        "assertions": [{"assertion_id": "S010-C1-A1", "kind": "observation", "text": "The destructive button reads Publish while the reporter expects Delete.", "evidence_refs": ["S010-E1", "S010-E2"]}],
        "acceptance_criteria": ["The destructive button reads Delete."],
        "suggested_verification": ["Open the synthetic admin detail."],
        "uncertainty": []
      }],
      "clarifications": []
    },
    {
      "session_id": "SYN-011",
      "candidates": [{
        "candidate_id": "S011-C1",
        "title": "Retry leaves the offline state unchanged",
        "actual": "Retry leaves the banner and stale content in place.",
        "expected": "Retry should refresh or show an actionable failure.",
        "assertions": [{"assertion_id": "S011-C1-A1", "kind": "observation", "text": "After Retry, the Offline banner and stale content remain.", "evidence_refs": ["S011-E1", "S011-E3"]}],
        "acceptance_criteria": ["Retry visibly retries and refreshes or presents a failure state."],
        "suggested_verification": ["Exercise Retry against a controlled synthetic 503."],
        "uncertainty": ["No second request event is available."]
      }],
      "clarifications": []
    },
    {
      "session_id": "SYN-012",
      "candidates": [{
        "candidate_id": "S012-C1",
        "title": "Book details navigates to Home",
        "actual": "Book details opens Home.",
        "expected": "It should open the selected book detail.",
        "assertions": [{"assertion_id": "S012-C1-A1", "kind": "observation", "text": "The tap navigates to Home and the frozen source calls navigate('Home').", "evidence_refs": ["S012-E1", "S012-E2", "S012-E3"]}],
        "acceptance_criteria": ["Book details opens the selected book detail screen."],